<?xml version="1.0" encoding="UTF-8"?>
<sec:CMOReturn xmlns:sec="urn:sec:cmo:reporting:v1"
               xmlns:xsi="http://www.w3.org/2001/XMLSchema-instance"
               xsi:schemaLocation="urn:sec:cmo:reporting:v1 SEC_CMO_Return_Schema_v1.0.xsd"
               schemaVersion="1.0">

  <sec:Header>
    <sec:SECRegNo>SEC/RC/0245/08</sec:SECRegNo>
    <sec:CMOName>Sample Securities Limited</sec:CMOName>
    <sec:ReturnType>CAP</sec:ReturnType>
    <sec:CMOCategory>BrokerDealer</sec:CMOCategory>
    <sec:ReportingPeriodStart>2026-01-01</sec:ReportingPeriodStart>
    <sec:ReportingPeriodEnd>2026-03-31</sec:ReportingPeriodEnd>
    <sec:SubmissionDateTime>2026-04-28T14:00:00Z</sec:SubmissionDateTime>
    <sec:ContactPerson>Adaeze Okonkwo</sec:ContactPerson>
    <sec:ContactEmail>compliance@samplesecurities.com.ng</sec:ContactEmail>
  </sec:Header>

  <sec:NetCapital>
    <sec:PaidUpCapital>1800000.00</sec:PaidUpCapital>
    <sec:SharePremium>500000.00</sec:SharePremium>
    <sec:RetainedEarnings>420000.00</sec:RetainedEarnings>
    <sec:OtherReserves>80000.00</sec:OtherReserves>
    <sec:TotalEquity>2800000.00</sec:TotalEquity>
    <sec:TotalDeductions>185000.00</sec:TotalDeductions>
    <sec:NetCapital>2615000.00</sec:NetCapital>
    <sec:MinCapitalRequirement>2000000.00</sec:MinCapitalRequirement>
    <sec:Surplus>615000.00</sec:Surplus>
    <sec:IsCompliant>true</sec:IsCompliant>
  </sec:NetCapital>

  <sec:TradingActivity>
    <sec:MarketTrade>
      <sec:MarketName>NGX Main Board - Equities</sec:MarketName>
      <sec:NumberOfTrades>18500</sec:NumberOfTrades>
      <sec:Volume>285000000</sec:Volume>
      <sec:Value>42500.00</sec:Value>
    </sec:MarketTrade>
    <sec:MarketTrade>
      <sec:MarketName>FMDQ - Bonds / FGN Securities</sec:MarketName>
      <sec:NumberOfTrades>320</sec:NumberOfTrades>
      <sec:Volume>850000</sec:Volume>
      <sec:Value>68000.00</sec:Value>
    </sec:MarketTrade>
    <sec:MarketTrade>
      <sec:MarketName>FMDQ - Money Market / T-Bills</sec:MarketName>
      <sec:NumberOfTrades>480</sec:NumberOfTrades>
      <sec:Volume>1200000</sec:Volume>
      <sec:Value>35000.00</sec:Value>
    </sec:MarketTrade>
    <sec:TotalTradingValue>145500.00</sec:TotalTradingValue>
    <sec:ActiveClientAccounts>4250</sec:ActiveClientAccounts>
    <sec:MarginLoansOutstanding>1250.00</sec:MarginLoansOutstanding>
    <sec:ClientFundsHeld>3800.00</sec:ClientFundsHeld>
  </sec:TradingActivity>

  <sec:Signature>
    <sec:PreparedBy>
      <sec:Name>Funke Adeyemi</sec:Name>
      <sec:Designation>Head, Compliance &amp; Risk Management</sec:Designation>
      <sec:Date>2026-04-25</sec:Date>
    </sec:PreparedBy>
    <sec:MDSignOff>
      <sec:Name>Ikechukwu Nwosu</sec:Name>
      <sec:Designation>Managing Director / CEO</sec:Designation>
      <sec:Date>2026-04-28</sec:Date>
    </sec:MDSignOff>
    <sec:CertificationStatement>I/We certify that the information provided is true, accurate, and complete to the best of our knowledge and in compliance with the Investments and Securities Act 2025 and SEC Rules and Regulations.</sec:CertificationStatement>
  </sec:Signature>

</sec:CMOReturn>
